trial_id,title,intervention_name,intervention_type,phase,status,summary,sponsor,outcome
NCT03207529,Phase Ib Study of BYL719 (Alpelisib) in Combination With Androgen Receptor Inhibitor (Enzalutamide) in Patients With Androgen Receptor (AR)-Positive and PTEN Positive Metastatic Breast Cancer,Alpelisib; Enzalutamide,DRUG; DRUG,,COMPLETED,This phase I trial studies the side effects and best dose of alpelisib when given together with enzalutamide in treating patients with androgen receptor and PTEN positive breast cancer that has spread to other places in the body. Alpelisib may stop the growth of tumor cells by blocking some of the enzymes needed for cell growth. Androgen receptor can cause the growth of breast cancer cells. Hormone therapy using enzalutamide may fight breast cancer by lowering the amount of androgen the body makes. Giving alpelisib and enzalutamide may work better in treating patients with breast cancer.,M.D. Anderson Cancer Center,1.0
NCT01930292,"A Phase I Study to Evaluate the Safety and Determine the Maximum Tolerated Dose (MTD) of Debio 1143 Combined With Carboplatin and Paclitaxel in Patients With Squamous Non-Small Cell Lung Cancer (NSCLC), Platinum-refractory Ovarian Cancer, and Basal-like/Claudin Low Triple Negative Breast Cancer (TNBC)",Part A: Debio 1143; Paclitaxel; Carboplatin; Part B: Debio 1143,DRUG; DRUG; DRUG; DRUG,,TERMINATED,"This is a two-part trial in patients with squamous non-small cell lung cancer (NSCLC), platinum (Pt)-refractory ovarian cancer, and basal-like/claudin low triple negative breast cancer (TNBC).

The primary objective of Part A is to determine the maximum tolerated dose (MTD) of Debio 1143 when administered to these patients in combination with full doses of paclitaxel and carboplatin.

The primary objective of Part B is to consolidate the safety profile of the recommended dose of Debio 1143 when administered to these patients in combination with full doses of paclitaxel and carboplatin.",Debiopharm International SA,0.0
NCT02157792,"An Open-Label, First-in-Human Study of the Safety, Tolerability, and Pharmacokinetics of VX-970/M6620 in Combination With Cytotoxic Chemotherapy in Participants With Advanced Solid Tumors",M6620; Gemcitabine; Cisplatin; Etoposide; Carboplatin; Irinotecan,DRUG; DRUG; DRUG; DRUG; DRUG; DRUG,,COMPLETED,"An Open-Label, First-in-Human Study of the Safety, Tolerability, and Pharmacokinetics (PK) of M6620 in Combination With Cytotoxic Chemotherapy in Participants With Advanced Solid Tumors","EMD Serono Research & Development Institute, Inc.",1.0
NCT04174391,Lifestyles for the Prevention of Relapses Among Women with Early Breast Cancer,Mediterranean diet supplemented with extra-virgin olive oil; Low-fat diet,BEHAVIORAL; BEHAVIORAL,,ACTIVE_NOT_RECRUITING,"Background: In Spain, 1 out of every 11 women will have a breast cancer before the age of 85 years and breast cancer is the leading cause of potential years of life lost. The randomized intervention in PREDIMED trail, using Mediterranean diet with free provision of extra virgin olive oil (MedDiet+EVOO) dramatically and significantly reduced the occurrence of cases of postmenopausal breast cancer.

Objectives: Assess the efficacy of a nutritional intervention with MedDiet+EVOO for the prevention of relapses among women with early breast cancer.

Methods: Randomized, multicenter trial (LifeBreast) among 766 women diagnosed with early breast cancer. Participants will be randomized in a 1:1 ratio to i) MedDiet+EVOO or ii) low-fat diet. Changes in circulating tumor cells, inflammatory biomarkers, oxidative stress and quality of life will be evaluated. The intervention will be delivered by face-to-face interviews with study dietitian, phone calls, and online tools. Participants in the MedDiet+EVOO group will receive 0.5l/week of EVOO and participants in the low-fat group will receive allotments of different foods, both at no cost. Generalized estimating equations will be used to estimate between-group differences in the following outcomes: circulating tumor cells, inflammatory biomarkers, oxidative stress, and quality of life will be evaluated.",University of Navarra,1.0
NCT02883062,"Randomized Phase 2 Study of Neoadjuvant Chemotherapy, Carboplatin and Paclitaxel, With or Without Atezolizumab in Triple Negative Breast Cancer (TNBC)",Atezolizumab; Biospecimen Collection; Carboplatin; Lumpectomy; Mastectomy; Paclitaxel,DRUG; PROCEDURE; DRUG; PROCEDURE; PROCEDURE; DRUG,,COMPLETED,"This phase II trial studies how well carboplatin and paclitaxel with or without atezolizumab before surgery works in treating patients with newly diagnosed, stage II-III triple negative breast cancer. Immunotherapy with monoclonal antibodies, such as atezolizumab, may help the body's immune system attack the cancer, and may interfere with the ability of tumor cells to grow and spread. Drugs used in chemotherapy, such as carboplatin and paclitaxel, work in different ways to stop the growth of tumor cells, either by killing the cells, by stopping them from dividing, or by stopping them from spreading. Giving carboplatin and paclitaxel with or without atezolizumab before surgery may make the tumor smaller and reduce the amount of normal tissue that needs to be removed.",National Cancer Institute (NCI),1.0
NCT02455791,Pilot Study for Identification of Breast Cancer Patients for Potential Avoidance of Surgery: Accuracy of Image Guided Percutaneous Sampling Compared With Surgery to Evaluate Eradication of Breast Cancer After Preoperative Chemotherapy,Ultrasound-Guided Biopsy,PROCEDURE,,ACTIVE_NOT_RECRUITING,The goal of this clinical research study is to compare the use of an ultrasound-guided biopsy with what is found during surgery in finding evidence of the disease.,M.D. Anderson Cancer Center,1.0
NCT01186991,"A Randomized, Phase II, Multicenter, Double-Blind, Placebo-Controlled Study Evaluating the Safety and Efficacy of Onartuzumab And/or Bevacizumab in Combination With Paclitaxel in Patients With Metastatic, Triple-Negative Breast Cancer",Onartuzumab; Bevacizumab; Paclitaxel; Bevacizumab Placebo; Onartuzumab Placebo,DRUG; DRUG; DRUG; DRUG; DRUG,,COMPLETED,"This is a randomized, Phase II, double-blind, multicenter, placebo-controlled trial designed to preliminarily estimate the efficacy and evaluate the safety and tolerability of onartuzumab (MetMAb) + bevacizumab + paclitaxel and onartuzumab + placebo + paclitaxel versus placebo + bevacizumab + paclitaxel in participants with metastatic or locally recurrent, triple-negative breast cancer who either have not received treatment (first-line) or have progressed after one conventional cytotoxic chemotherapy regimen (second-line).","Genentech, Inc.",1.0
NCT03872791,"A Phase Ib/II Study to Evaluate Efficacy, Safety and Tolerability of KN046 Monotherapy or in Combination With Nab-paclitaxel in Subjects With Triple-negative Breast Cancer",KN046; Nab-paclitaxel,BIOLOGICAL; DRUG,,COMPLETED,"This is an open-label, phase Ib/II, multi-center study to evaluate efficacy and safety of KN046 alone or in combination with nab-paclitaxel in subjects with locally advanced unresectable or metastatic triple negative breast cancer (TNBC). The study is composed of dose escalation and expansion parts. Every subject will subject tumor tissue used for biomarker evaluation. Each subject will receive KN046 or in combination with nab-paclitaxel untill confirmed progressive disease, unacceptable toxicity or withdrawal of informed consent whichever occurs first.","Jiangsu Alphamab Biopharmaceuticals Co., Ltd",1.0
NCT02368691,"A Phase 2 Open Label, Multi-Center, Multinational Study Investigating The Efficacy and Safety Of GTx-024 On Advanced, Androgen Receptor-Positive Triple Negative Breast Cancer (AR+ TNBC)",GTx-024,DRUG,,TERMINATED,"The purpose of this study is to determine if GTx-024 is effective and safe in the treatment of patients with advanced, androgen receptor positive triple negative breast cancer (AR+ TNBC).",GTx,0.0
NCT05134194,"A Muti-center, Open-label, Randomized, Phase III Study of Camrelizumab Plus Treatment of Physician Choice Versus Treatment of Physician Choice for Metastatic Triple-Negative Breast Cancer Who Received at Least Two Prior Systemic Chemotherapy Regimens for Advanced/Metastatic Setting",Camrelizumab、Capecitabine/eribulin/gemcitabine/vinorelbine; Capecitabine/eribulin/gemcitabine/vinorelbine,DRUG; DRUG,,TERMINATED,"Approximately 104 subjects with recurrent or metastatic IM triple negative breast cancer were planned to be included in the study, and screened eligible subjects were randomly assigned in a 1:1 ratio to treatment with the combination of Camrelizumab and investigator's choice of chemotherapy (test arm), treatment with investigator's choice of chemotherapy (control arm), and the stratification factor was liver metastasis (with vs without). After enrollment, subjects in the test group were treated with Camrelizumab 200 mg IV every 3 weeks for one cycle. The investigator's choice of single agent chemotherapy regimen (capecitabine, eribulin, gemcitabine, or vinorelbine) was every 3 weeks for one cycle until disease progression, intolerable toxicity, withdrawal of informed consent, or discontinuation at the investigator's discretion.","Suzhou Suncadia Biopharmaceuticals Co., Ltd.",0.0
NCT04489940,"A Phase II, Multicenter, Open Label Study of Bintrafusp Alfa (M7824) Monotherapy in Participants With HMGA2-expressing Triple Negative Breast Cancer",Bintrafusp alfa,DRUG,,TERMINATED,The main purpose of this study was to evaluate bintrafusp alfa monotherapy in participants with triple negative breast cancer (TNBC) who express high levels of HMGA2 as determined by a centralized reverse transcriptase-polymerase chain reaction (RT-PCR) test.,"EMD Serono Research & Development Institute, Inc.",0.0
NCT03199040,A Randomized Phase 1 Trial of Neoantigen DNA Vaccine Alone vs. Neoantigen DNA Vaccine Plus Durvalumab in Triple Negative Breast Cancer Patients Following Standard of Care Therapy,Durvalumab; Neoantigen DNA vaccine; TDS-IM system (Inchor Medical Systems); Peripheral blood draw,DRUG; BIOLOGICAL; DEVICE; PROCEDURE,,TERMINATED,"This is a single institution, open-label randomized phase 1 trial of neoantigen DNA vaccine alone vs. neoantigen DNA vaccine plus durvalumab in triple negative breast cancer (TNBC) patients following standard of care therapy. Patients with newly diagnosed clinical stage II-III TNBC are eligible for enrollment. Patients will receive standard of care therapy including chemotherapy, surgery and radiation therapy as clinically indicated. Following standard of care therapy, patients will be randomized to receive either a neoantigen DNA vaccine alone, or a neoantigen DNA vaccine + durvalumab.",Washington University School of Medicine,0.0
NCT02706392,Phase I Study of Adoptive Immunotherapy for Advanced ROR1+ Malignancies With Defined Subsets of Autologous T Cells Engineered to Express a ROR1-Specific Chimeric Antigen Receptor,Laboratory Biomarker Analysis; ROR1 CAR-specific Autologous T-Lymphocytes,OTHER; BIOLOGICAL,,TERMINATED,"This phase I trial studies the side effects and best dose of genetically modified T-cell therapy in treating patients with receptor tyrosine kinase-like orphan receptor 1 positive (ROR1+) chronic lymphocytic leukemia (CLL), mantle cell lymphoma (MCL), acute lymphoblastic leukemia (ALL), stage IV non-small cell lung cancer (NSCLC), or triple negative breast cancer (TNBC) that has spread to other places in the body and usually cannot be cured or controlled with treatment (advanced). Genetically modified therapies, such as ROR1 specific chimeric antigen receptor (CAR) T-cells, are taken from a patient's blood, modified in the laboratory so they specifically may kill cancer cells with a protein called ROR1 on their surfaces, and safely given back to the patient after conventional therapy. The ""genetically modified"" T-cells have genes added in the laboratory to make them recognize ROR1.",Fred Hutchinson Cancer Center,0.0
NCT04149444,A Phase 2 Study of Trifluridine/Tipiracil in Triple Negative Metastatic Breast Cancer,Trifluridine/Tipiracil,DRUG,,WITHDRAWN,"This is an open-label, single arm, multi-stage, phase II trial of Trifluridine/tipiracil as a palliative treatment for patients with metastatic triple negative breast cancer who have failed both a taxane and anthracycline or have contraindications to these agents.",AHS Cancer Control Alberta,0.0
NCT06371989,Vacuum Assisted Biopsy and Surgery Correlation in HER2 and TN Breast Cancer Subtypes MRI Responders After Neoadjuvant Therapy: BISUCO TRIAL,Image guided vacuum assisted biopsy,PROCEDURE,,COMPLETED,"BACKGROUND AND CURRENT STATUS:

Advancements in neoadjuvant systemic treatments (NST) for HER2 positive and triple-negative (TN) breast cancer (BC) subtypes have led to high rates of pathologic complete response (pCR), raising questions about the necessity of subsequent surgery, especially for those undergoing adjuvant radiotherapy. While Magnetic Resonance Imaging (MRI) remains the most effective imaging technique for assessing neoadjuvant treatment response, surgery is still required to confirm pCR in cases of almost complete or complete MRI response (iCR). To safely avoid surgery in these BC ""exceptional responders,"" a technique with high negative predictive value is imperative.

OBJECTIVE:

This study aims to establish the diagnostic efficacy of image-guided vacuum-assisted biopsy (VAB) in assessing pathological complete response (pCR) after NST in HER2 positive or TN breast cancer subtypes, particularly those showing post NST-MRI complete or almost complete response.

METHODS:

A prospective study was conducted at ""Hospital Universitario 12 de Octubre de Madrid"" from June 25, 2018, to October 25, 2029. Twenty-five patients with HER2-positive or TN operable invasive ductal carcinoma (IDC) BC subtype, at stages cT1-3/N0-2 undergoing primary NST and showing complete or almost complete response on post NST-MRI, were enrolled. Ultrasound or stereotactic-guided vacuum-assisted biopsy (VAB) of the previous clip and tumor bed area was performed before surgery. VAB pathological results were compared with surgical pathological results to evaluate the diagnostic efficacy of predicting pCR with VAB after NST. Pathological representativeness of the VAB sample was ensured. pCR was defined as the absence of invasive ductal carcinoma and in situ ductal carcinoma.",Hospital Universitario 12 de Octubre,1.0
NCT01167192,Effect of Neoadjuvant Platinum-based Chemoradiation Therapy for Locally Advanced Triple Negative Breast Cancer: Clinical Outcome and Correlation to Biological Parameters,Cisplatin; Carboplatin; Radiation therapy; Mastectomy (recommended but not mandatory),DRUG; DRUG; RADIATION; PROCEDURE,,TERMINATED,"The purpose of this study is to determine whether platinum-based chemotherapy (either cisplatin or carboplatin), when given with radiation therapy prior to surgery, is effective in improving response to treatment in triple negative breast cancer patients. This treatment is being studied in this type of breast cancer because it does not respond well to commonly used treatments such as tamoxifen or herceptin.",Washington University School of Medicine,0.0
NCT04081389,Phase I Clinical Trial Assessing the Combination of Chemokine Modulation With Neoadjuvant Chemotherapy in Triple Negative Breast Cancer,Celecoxib; Cyclophosphamide; Doxorubicin; Doxorubicin Hydrochloride; Paclitaxel; Recombinant Interferon Alfa-2b; Rintatolimod,DRUG; DRUG; DRUG; DRUG; DRUG; BIOLOGICAL; DRUG,,COMPLETED,"This phase I trial studies how well chemokine modulation therapy and standard chemotherapy given before surgery work in treating patients with early stage triple negative breast cancer. Chemokine modulation therapy, including celecoxib, recombinant interferon alfa-2b, and rintatolimod, may stimulate the immune system and stop tumor cells from growing. Drugs used in standard chemotherapy, such as paclitaxel, doxorubicin, and cyclophosphamide, work in different ways to stop the growth of tumor cells, either by killing the cells, by stopping them from dividing, or by stopping them from spreading. Giving chemokine modulation therapy together with standard chemotherapy may work better than giving either therapy alone in treating patients with triple negative breast cancer.",Roswell Park Cancer Institute,1.0
NCT01520389,A Phase 1 and Pharmacologic Study of MM-151 in Patients With Refractory Advanced Solid Tumors,MM-151; MM-151 + irinotecan,DRUG; DRUG,,COMPLETED,"This study is a Phase 1 and pharmacologic open-labeled dose-escalation trial using a ""3+3"" design, evaluating MM-151 at varying dose levels and frequencies, and subsequently in combination with irinotecan.",Merrimack Pharmaceuticals,1.0
NCT05712889,"An Open-label, Multicenter Phase 1 Study to Characterize Safety, Tolerability, Preliminary Antitumor Activity and Pharmacokinetics of VIP236 Monotherapy in Subjects With Advanced Cancer",VIP236 (Q3W); VIP236 (Q2W),DRUG; DRUG,,COMPLETED,"Determine the safety, tolerability, and maximum tolerated dose (MTD) of IV administered VIP236 as monotherapy in patients with advanced solid tumor cancer","Vincerx Pharma, Inc.",1.0
NCT02445391,A Randomized Phase III Post-operative Trial of Platinum Based Chemotherapy vs. Capecitabine in Patients With Residual Triple-Negative Basal-Like Breast Cancer Following Neoadjuvant Chemotherapy,Capecitabine; Carboplatin; Cisplatin,DRUG; DRUG; DRUG,,ACTIVE_NOT_RECRUITING,"This randomized phase III trial studies how well cisplatin or carboplatin (platinum based chemotherapy) works compared to capecitabine in treating patients with remaining (residual) basal-like triple-negative breast cancer following chemotherapy after surgery (neoadjuvant). Drugs used in chemotherapy, such as cisplatin, carboplatin and capecitabine, work in different ways to stop the growth of tumor cells, either by killing the cells, by stopping them from dividing, or by stopping them from spreading. It is not yet known whether cisplatin or carboplatin is more effective than capecitabine in treating patients with residual triple negative basal-like breast cancer.",ECOG-ACRIN Cancer Research Group,1.0
NCT02187991,"A Phase II, Multicenter, Randomized, Parallel Group Study to Compare Alisertib in Combination With Paclitaxel vs. Paclitaxel Alone in Patients With Metastatic or Locally Recurrent Breast Cancer",Paclitaxel; Alisertib,DRUG; DRUG,,COMPLETED,"The goal of this clinical research study is to learn if the study drug, alisertib (MLN8237), in combination with chemotherapy (paclitaxel), can shrink or slow tumor growth in women with hormone receptor (HR)-positive, human epidermal growth factor receptor 2 (HER2)-negative or HR-negative, HER2-negative (triple negative) locally recurrent or metastatic breast cancer (MBC). The safety of alisertib in combination with paclitaxel will also be studied. The physical state of the patient, symptoms, changes in the size of the tumor, and laboratory findings obtained while on-study will help the research team decide if alisertib plus paclitaxel is safe and effective in patients with this type of breast cancer.

Alisertib belongs to a group of drugs called Aurora kinase inhibitors. Alisertib blocks the activity of Aurora A kinase, a protein that is involved in tumor cell multiplication and survival. Aurora A kinase is expressed at higher than normal levels in many types of cancer, including breast cancer, and preclinical studies suggest that blocking the activity of this protein can lead to the death of cancer cells.

Paclitaxel is a chemotherapy drug commonly used to treat many different kinds of cancer, including metastatic breast cancer. The reason to combine alisertib and paclitaxel is that in cancer therapy, combinations of drugs are often more effective as a treatment than either of the same drugs used alone.",US Oncology Research,1.0
NCT03473691,Pilot Study of the Antibody-drug Conjugate Glembatumumab Vedotin (CDX-011) Following Doxorubicin (Adriamycin) and Cytoxan as Neo-adjuvant Therapy in Glycoprotein NMB-expressing High Risk Triple Negative Breast Cancer,Glembatumumab Vedotin,DRUG,,WITHDRAWN,"This is a single arm, pilot study assessing safety/feasibility and efficacy of neo-adjuvant glembatumumab vedotin (GV) in patients with high risk triple negative breast cancer (TNBC) with glycoprotein-NMB (gpNMB) expression ≥ 25%. Primary endpoints will be safety/feasibility, and secondary endpoints will be rates of pathologic complete response (pCR), and measurements of growth differentiation factor-11 (GDF11) and glycoprotein NMB (gpNMB) expression.",University of Virginia,0.0
NCT03075462,"An Open, Non-randomised, Multi-centre Phase I Study to Assess the Safety and Efficacy of Fluzoparib Given in Combination With Apatinib in Patients With Recurrent Ovarian Cancer or Triple Negative Breast Cancer",Fluzoparib; Apatinib,DRUG; DRUG,,COMPLETED,"Fluzoparib is an oral potent, selective poly-ADP ribose polymerase-1 (PARP-1) and PARP-2 inhibitor; Apatinib is an oral selective vascular endothelial growth factor receptor (VEGFR) inhibitor. This open-label, dose finding phase I trial studies the tolerability and the best dose of fluzoparib in combination with apatinib and to see how well these two drugs work together in the treatment of patients with recurrent ovarian cancer or triple negative breast cancer. The safety and efficacy of fluzoparib in combination with apatinib will be explored. Both dose escalation and dose expansion parts are included in this study.","Jiangsu HengRui Medicine Co., Ltd.",1.0
NCT01846091,Phase I Trial of Intratumoral Administration of a NIS-Expressing Derivative Manufactured From a Genetically Engineered Strain of Measles Virus in Patients With Recurrent/Metastatic Squamous Cell Carcinoma of the Head and Neck or Metastatic Breast Cancer,Laboratory Biomarker Analysis; Oncolytic Measles Virus Encoding Thyroidal Sodium Iodide Symporter,OTHER; BIOLOGICAL,,COMPLETED,"This phase I trial studies the side effects and the best dose of viral therapy in treating patients with squamous cell carcinoma of the head and neck that has returned (come back) after a period of improvement or has spread to other parts of the body or breast cancer that has spread to other parts of the body. A virus called encoding thyroidal sodium iodide symporter, which has been changed in a certain way, may be able to kill tumor cells without damaging normal cells.",Mayo Clinic,1.0
NCT04434560,"A Phase II Trial of Surgery and Stereotactic Radiosurgery With Neoadjuvant Nivolumab and Ipilimumab in Patients With Surgically-resectable, Solid Tumor Brain Metastases",Nivolumab; Ipilimumab,DRUG; DRUG,,TERMINATED,"The purpose of this phase 2 study is to assess the feasibility and efficacy of neoadjuvant immunotherapy in patients with previously untreated, surgically-resectable, solid tumor brain metastases. The primary objectives of this study are to 1) assess the feasibility of neoadjuvant ipilimumab and nivolumab treatment before surgery and stereotactic radiosurgery (SRS) in patients with solid tumor brain metastases as measured by the proportion of patients who have their surgery delayed or surgery never occurs, and 2) demonstrate that neoadjuvant immunotherapy will increase proliferation of circulating T-cells compared to baseline measurements. Exploratory objectives include describing patient progression free survival and overall survival, time to local and distant intracranial progression, and the rate of radiation necrosis. The rate of radionecrosis will also be explored, as immune expression profiles.","Sarah Sammons, MD",0.0
NCT00827567,A Phase II Trial of RAD001 in Triple Negative Metastatic Breast Cancer,RAD 001,DRUG,,TERMINATED,"The hypothesis of this clinical research study is to discover if the study drug RAD001 can shrink or slow the growth of Estrogen Receptor/Progesterone Receptor (ER/PR) negative or Human Epidermal growth factor Receptor 2 (Her2 Neu) negative breast cancer. The safety of RAD001 will also be studied. Patients physical state, symptoms, changes in the size of the tumor, and laboratory findings obtained while on-study will help the research team decide if RAD001 is safe and effective.",Milton S. Hershey Medical Center,0.0
NCT03435640,"A Phase 1/2, Open-label, Multicenter, Dose Escalation and Dose Expansion Study of NKTR-262 in Combination With Bempegaldesleukin (NKTR-214) With or Without Nivolumab in Patients With Locally Advanced or Metastatic Solid Tumor Malignancies",NKTR-262; bempegaldesleukin; nivolumab,DRUG; DRUG; DRUG,,TERMINATED,"Patients received intratumoral (IT) injections of NKTR-262 in 3-week cycles for up to 3 cycles; bempegaldesleukin with or without nivolumab was administered every 3 weeks (q3w), and treatment continued until unacceptable toxicity, death, or disease progression per RECIST 1.1. Based on Phase 1 results of the study, the decision was made not to start the Phase 2 part of the study and the study was terminated.",Nektar Therapeutics,0.0
NCT04464967,"A Phase 1/2a, Open-Label, Multi-Center Study Evaluating the Safety and Anti-Tumor Activity of Ex Vivo Expanded, Autologous Natural Killer Cells (SNK01) in Combination With Trastuzumab or Cetuximab in Subjects With Advanced/Metastatic HER2- or EGFR-Expressing Cancers",SNK01; Trastuzumab; Cetuximab,BIOLOGICAL; DRUG; DRUG,,WITHDRAWN,"The purpose of the Phase 1/2a study is to evaluate the safety and tolerability of SNK01 in combination with trastuzumab or cetuximab in order to determine the maximum tolerated dose (MTD)/recommended Phase 2 dose (RP2D), and the preliminary efficacy for each combination regimen.","NKGen Biotech, Inc.",0.0
