trial_id,title,intervention_name,intervention_type,phase,status,summary,sponsor,outcome
NCT02178722,"A Phase 1/2 Study Exploring the Safety, Tolerability, and Efficacy of MK-3475 in Combination With INCB024360 in Subjects With Selected Cancers (ECHO-202/KEYNOTE-037)",MK-3475; INCB024360,DRUG; DRUG,,COMPLETED,"The purpose of this study was to assess the safety, tolerability, and efficacy when combining MK-3475 and INCB024360 in participants with certain cancers. This study was conducted in 2 phases, Phase 1 and Phase 2.",Incyte Corporation,1.0
NCT04176848,A Phase II Study of CFI-400945 and Durvalumab in Patients With Advanced/Metastatic Triple Negative Breast Cancer (TNBC),CFI-400945; Durvalumab,DRUG; DRUG,,ACTIVE_NOT_RECRUITING,The purpose of this study is to find out the effect that CFI-400945 and durvalumab have on breast cancer.,Canadian Cancer Trials Group,1.0
NCT02627430,"A Phase 1 Study of PARP Inhibitor BMN 673 and HSP90 Inhibitor AT13387 for Treatment of Advanced Solid Tumors With Expansion in Patients With Recurrent Epithelial Ovarian, Fallopian Tube, Peritoneal Cancer or Recurrent Triple-Negative Breast Cancer",Hsp90 Inhibitor AT13387; Laboratory Biomarker Analysis; Pharmacological Study; Talazoparib,DRUG; OTHER; OTHER; DRUG,,WITHDRAWN,"This phase I trial studies the side effects and best dose of talazoparib and heat shock protein (HSP)90 inhibitor AT13387 when given together in treating patients with solid tumors that have spread to other places in the body (metastatic) or ovarian, fallopian tube, primary peritoneal, or hormone negative breast cancer that have come back after a period of improvement (recurrent). Talazoparib and HSp90 inhibitor AT13387 may stop the growth of tumor cells by blocking some enzymes that are need for cell growth. HSp90 inhibitor AT1338 may also help talazoparib work better by making tumor cells more sensitive to the drug.",National Cancer Institute (NCI),0.0
NCT03310957,"Single Arm, Open Label Phase 1b/2 Study of SGN-LIV1A in Combination With Pembrolizumab for First-Line Treatment of Patients With Unresectable Locally-Advanced or Metastatic Triple-Negative Breast Cancer",ladiratuzumab vedotin; Pembrolizumab,DRUG; DRUG,,COMPLETED,This trial studies ladiratuzumab vedotin (LV) with pembrolizumab in patients with triple-negative breast cancer. It will find out what side effects happen when participants get these two drugs. A side effect is anything the drugs do besides treating cancer. Pembrolizumab is a drug that can be used to treat triple-negative breast cancer. The trial will also find out if these drugs work to treat this type of cancer. Participants in this study have metastatic breast cancer. This means the cancer has spread to other parts of the body.,Seagen Inc.,1.0
NCT02632448,A Phase 1b/2a Three-Part Open-Label Multicenter Study to Evaluate the Safety and Efficacy of LY2880070 as Monotherapy and in Combination With Gemcitabine in Patients With Advanced or Metastatic Cancer,LY2880070; Gemcitabine,DRUG; DRUG,,COMPLETED,The main purpose of this 3-part study is to evaluate the safety and efficacy of the study drug known as LY2880070 in participants with advanced or metastatic solid tumors.,Esperas Pharma Inc.,1.0
NCT02996825,"A Phase I Dose-Escalation Safety and Tolerability Study of MirvetuximabSoravtansine (IMGN853) and Gemcitabine in Patients With FRa-positive Recurrent Ovarian, Primary Peritoneal, Fallopian Tube, Endometrial Cancer, or Triple Negative Breast Cancer (TNBC)",Gemcitabine; Gemcitabine Hydrochloride; Laboratory Biomarker Analysis; Mirvetuximab Soravtansine; Pharmacological Study,DRUG; DRUG; OTHER; BIOLOGICAL; OTHER,,COMPLETED,"This phase I trial studies the side effects and best dose of mirvetuximab soravtansine and gemcitabine hydrochloride in treating patients with folate receptor (FR) alpha-positive ovarian, primary peritoneal, fallopian tube, endometrial, or triple negative breast cancer that has come back. Mirvetuximab soravtansine is a monoclonal antibody, called mirvetuximab, linked to a chemotherapy drug called DM4. Mirvetuximab attaches to FOLR1 positive cancer cells in a targeted way and delivers DM4 to kill them. Drugs used in the chemotherapy, such as gemcitabine hydrochloride, work in different ways to stop the growth of tumor cells, either by killing the cells, by stopping them from dividing, or by stopping them from spreading. Giving mirvetuximab soravtansine and gemcitabine may work better in treating patients with FRalpha-positive ovarian, primary peritoneal, fallopian tube, endometrial, or triple negative breast cancer.",City of Hope Medical Center,1.0
NCT02730130,A Multicenter Single Arm Phase II Study to Assess the Efficacy of Pembrolizumab Plus Radiotherapy in Metastatic Triple Negative Breast Cancer Patients,Pembrolizumab; Radiotherapy,DRUG; RADIATION,,COMPLETED,"The purpose of this study is to find out what effects, good and/or bad, pembrolizumab has on the patient and areas of cancer in their body that did not receive radiation therapy.",Memorial Sloan Kettering Cancer Center,1.0
NCT01575522,A Phase 2 Study of ARQ 197 in Metastatic Triple-negative Breast Cancer,Laboratory Biomarker Analysis; Tivantinib,OTHER; DRUG,,COMPLETED,This phase II trial studies how well tivantinib works in treating patients with recurrent or metastatic breast cancer. Tivantinib may stop the growth of tumor cells by blocking some of the enzymes needed for cell growth.,National Cancer Institute (NCI),1.0
NCT01975831,"A Phase 1 Study to Evaluate the Safety and Tolerability of Anti-PD-L1, MEDI4736, in Combination With Tremelimumab in Subjects With Advanced Solid Tumors",Durvalumab; Tremelimumab,DRUG; DRUG,,COMPLETED,"This was a Phase 1, open-label, nonrandomized, multicenter study of durvalumab and tremelimumab in subjects with advanced cancers who were not eligible for, declined, or failed standard treatment. The primary study objective was to determine the maximum tolerated dose (MTD) and safety profile of the durvalumab and tremelimumab combination. Secondary objectives were to evaluate the pharmacokinetics (PK) and immunogenicity of durvalumab and tremelimumab, and the antitumor activity (tumor response, progression-free survival \[PFS\], and overall survival \[OS\]) of the durvalumab and tremelimumab combination. (Note: Collection of PK and immunogenicity samples was removed by amendment; analysis was not done.) Exploratory objectives were to evaluate the biological activity of the durvalumab and tremelimumab combination.",Ludwig Institute for Cancer Research,1.0
NCT02676986,Phase II Window of Opportunity Study of Short-term Preoperative Treatment With Enzalutamide (Alone or in Combination With Exemestane) in Patients With Primary Breast Cancer,Enzalutamide; Exemestane,DRUG; DRUG,,COMPLETED,"Open-label, international, multicentre window of opportunity phase II trial to evaluate the effects of short-term preoperative therapy with enzalutamide (alone or in combination with exemestane) in women with newly diagnosed invasive primary breast cancer. The study has two cohorts:

* ER+ve breast cancer
* AR+ve, Triple-negative (i.e. ER-negative, PR-negative and HER2-negative) breast cancer

Study treatment is planned for a minimum of 15 days and a maximum of 29 days unless there is evidence of unacceptable toxicity or the patient requests to be withdrawn from the trial. Thereafter, patients will either be considered for definitive surgery or primary medical treatment (e.g. neoadjuvant chemotherapy) at the discretion of the treating physician.

The effects of enzalutamide (alone or in combination with exemestane) will be assessed on tumour tissue specimens taken at baseline and on the last day of study treatment.",Queen Mary University of London,1.0
NCT05382286,"A Randomized, Open-label, Phase 3 Study of Sacituzumab Govitecan and Pembrolizumab Versus Treatment of Physician's Choice and Pembrolizumab in Patients With Previously Untreated, Locally Advanced Inoperable or Metastatic Triple-Negative Breast Cancer, Whose Tumors Express PD-L1",Sacituzumab Govitecan-hziy; Pembrolizumab; Paclitaxel; nab-Paclitaxel; Gemcitabine; Carboplatin,DRUG; DRUG; DRUG; DRUG; DRUG; DRUG,,ACTIVE_NOT_RECRUITING,"The primary objective of this study is to compare the progression-free survival (PFS) between sacituzumab govitecan-hziy (SG) and pembrolizumab versus treatment of physician's choice (TPC) and pembrolizumab in participants with previously untreated, locally advanced inoperable or metastatic triple-negative breast cancer, whose tumors express programmed cell death ligand 1 (PD-L1).",Gilead Sciences,1.0
NCT05774886,Pilot Study of an Implantable Microdevice to Evaluate Drug Responses in Situ in Early-stage Triple-negative Breast Cancer,Implantable Microdevice (IMD),COMBINATION_PRODUCT,,WITHDRAWN,"The goal of this research study is to evaluate the safety and feasibility of implanting and retrieving a microdevice that releases microdoses of a specific drug or combination of drugs as a possible tool to evaluate the effectiveness of several cancer drugs against early stage Triple Negative Breast Cancer (TNBC).

The name of the intervention involved in this study is:

Implantable Microdevice (IMD)",Dana-Farber Cancer Institute,0.0
NCT03295552,Decitabine Plus Carboplatin in the Treatment of Metastatic Triple Negative Breast Cancer,Decitabine; Carboplatin,DRUG; DRUG,,TERMINATED,To evaluate the effect of novel DNA demethylating agents in the treatment of metastatic TNBC,Shanghai Jiao Tong University School of Medicine,0.0
NCT02624700,Phase 2 Study of Pemetrexed and Sorafenib for Treatment of Recurrent or Metastatic Triple Negative Breast Cancer,Experimental Arm A: Pemetrexed; Experimental Arm A: Sorafenib; Experimental Arm B: Pemetrexed; Experimental Arm B: Sorafenib,DRUG; DRUG; DRUG; DRUG,,TERMINATED,This phase 2 clinical trial will evaluate the efficacy of the combination of pemetrexed and sorafenib in patients with recurrent or metastatic Triple Negative Breast Cancer (TNBC). Candidate pharmacodynamic and predictive biomarkers will also be evaluated.,Virginia Commonwealth University,0.0
NCT01238952,A Phase I Study of NK012 in Combination With Carboplatin in Patients With Advanced Solid Tumors Followed by a Dose Expansion Phase in Patients With Triple Negative Metastatic Breast Cancer,NK012 and carboplatin,DRUG,,COMPLETED,The primary objective is to determine the maximum tolerated dose/recommended phase II dose of the combination regimen of NK012 and carboplatin in patients with advanced solid tumors.,"Nippon Kayaku Co., Ltd.",1.0
NCT01251900,BRCA1 and BRCA2 Mutations and Triple Negative Disease in Hispanic/Latino Breast Cancer Subjects,,,,COMPLETED,"Background:

- BRCA1 and BRCA2 gene mutations have been linked to a higher risk of developing breast cancer and other cancers, and may be associated with types of breast cancer that are more difficult to treat and more likely to recur. New cancer treatments are being developed specifically to treat individuals who have these gene mutations. However, more information is needed about the prevalence of these mutations in minority populations, including Hispanic/Latino populations. To study these populations, researchers are interested in collecting genetic material (DNA) and medical history information from Hispanic/Latino women who have been diagnosed with breast cancer.

Objectives:

- To collect saliva samples and medical and family history information from Hispanic/Latino women with breast cancer.

Eligibility:

- Hispanic/Latino women at least 18 years of age who have been diagnosed with breast cancer.

Design:

* Participants will complete a questionnaire with information about place of birth, languages spoken by parents and grandparents, and information about their breast cancer diagnosis.
* Participants will provide a saliva sample (2 to 3 tablespoons) for analysis.
* No treatment will be provided as part of this protocol.",National Cancer Institute (NCI),1.0
NCT02358200,"Phase I Study to Evaluate the Tolerability, Safety and Efficacy of BMN-673 in Combination With Carboplatin and Paclitaxel in Patients With Advanced Solid Tumor Malignancies That Have BRCA Mutations or Triple Negative Metastatic Breast Cancer",BMN-673; Carboplatin; Paclitaxel,DRUG; DRUG; DRUG,,TERMINATED,"Open label, non-randomized, dose escalation and expansion Phase Ia/b trial to evaluate the safety of the combination of BMN 673 and carboplatin, and subsequently BMN 673 in combination with paclitaxel and carboplatin to determine the recommended Phase II dose of the combination.",Pamela Munster,0.0
NCT05757232,Construction of an Ultrasound Profile and a Mammography Profile Corresponding to the Different Molecular Subtypes of Brest Cancer. A Retrospective Study of 203 Cases Diagnosed During the National Screening Campaign in 2015-2018 (PROFILS),,,,COMPLETED,"PROFILS is a retrospective, exploratory study on data collected in 203 breast cancer cases diagnosed during a national screening campaign from 2015 to 2018.

The aim of the study is to analyse histological, clinical and radiological data collected during the screening campaign to build an ultrasound profile and a mammographic profile corresponding to brest cancers' different molecular sub-types (Luminal A, Luminal B, HER2+, Triple negative) using the BI-RADS classification.

The study has the following objectives:

* To compare molecular profiles of breast cancers detected in a cohort of women diagnosed with tomosynthesis and ultrasound with molecular profiles of brest cancers detected in the cohort of women diagnosed with classical mammography and ultrasound
* To describe molecular profiles of cancers detected only with ultrasound,",Elsan,1.0
NCT06052852,"A Phase 1/2, First-in-Human, Dose Escalation and Expansion Study of BDC-3042 as a Single Agent and in Combination With Cemiplimab in Patients With Advanced Malignancies",BDC-3042; Cemiplimab,DRUG; DRUG,,ACTIVE_NOT_RECRUITING,A first-in-human study using BDC-3042 as a single agent and in combination with cemiplimab in patients with advanced malignancies,"Bolt Biotherapeutics, Inc.",1.0
NCT01306032,"Phase II Randomized Trial of ABT-888 in Combination With Metronomic Oral Cyclophosphamide in Refractory BRCA-Positive Ovarian, Primary Peritoneal, Ovarian High-Grade Serous Carcinoma, Fallopian Tube Cancer, or Triple-Negative Breast Cancer",ABT-888; Cyclophosphamide,DRUG; DRUG,,COMPLETED,"Background:

- The experimental cancer treatment drug ABT-888 (Veliparib) works by preventing deoxyribonucleic acid (DNA) repair in tumor cells. Cyclophosphamide is a cancer treatment drug that works by causing DNA damage in cells, including cancer cells, resulting in cell death. However, because cyclophosphamide has strong and unpleasant side effects, researchers are interested in finding drugs that can be given in combination with cyclophosphamide that will allow a lower dose of cyclophosphamide to be given with similar effects. The combination of ABT-88 and cyclophosphamide may be an effective treatment for some types of cancer, such as certain kinds of breast or ovarian cancer and non-Hodgkin's lymphoma that often do not respond to standard therapies.

Objectives:

- To evaluate the safety and effectiveness of ABT-888 and cyclophosphamide in ovarian and breast cancer and in non-Hodgkin's lymphoma that have not responded to standard treatments.

Eligibility:

- Individuals at least 18 years of age who have been diagnosed with (1) (Breast cancer 1/2) BRCA1/2 ovarian cancer, primary peritoneal or ovarian high-grade carcinoma, or fallopian tube cancer; (2) triple-negative breast cancer (not responsive to hormone-related therapy); or (3) low grade non-Hodgkin's lymphoma.

Design:

* Participants will be screened with a full medical history and physical examination, blood and urine tests, and tumor imaging studies. Participants will be divided into two groups with different treatment subgroups.
* Group 1: Participants who have BRCA-positive ovarian cancer, primary peritoneal or ovarian high-grade serous carcinoma, or fallopian tube cancer
* Participants will receive either the combination of ABT-888 and cyclophosphamide, or cyclophosphamide alone.
* Participants will take the study drug by mouth once a day for 21-day cycles of treatment, and will keep a diary to record drug doses and any side effects.
* Participants will have clinic visits with blood and urine tests, imaging studies, and other examinations on days 1, 2, 7, and 14 of cycle 1, and on the first day of all other cycles.
* Group 2: Participants who have triple-negative breast cancer or non-Hodgkin's lymphoma
* Participants will receive either the combination of ABT-888 and cyclophosphamide, or cyclophosphamide alone.
* Participants will take the study drug by mouth once a day for 21-day cycles of treatment, and will keep a diary to record drug doses and any side effects.
* Participants will have clinic visits with blood and urine tests, imaging studies, and other examinations on days 1, 2, 7, and 14 of cycle 1, and on the first day of all other cycles.
* Participants receiving only cyclophosphamide who show signs of disease progression after tumor imaging studies can receive the combination of ABT-888 with cyclophosphamide.
* Treatment will continue as long as participants tolerate the drugs and the disease does not progress.",National Cancer Institute (NCI),1.0
NCT02247037,Patient-derived Xenograft (PDX) Modeling of Treatment Response for Triple Negative Breast Cancer,Chemotherapy,OTHER,,COMPLETED,"This study will determine if patient-derived tumor xenograft (PDX) mouse models can serve as a reliable model for treatment response for individual patients with triple negative breast cancer. The collection of patient tumor tissue will also provide insight into the mechanisms of therapeutic resistance for those individuals. Ultimately, this study will enhance our understanding of the genomic basis for treatment response for triple negative cancer on an individual basis, while having the potential to suggest new therapeutic options for high-risk triple negative breast cancer patients with residual disease post neoadjuvant.",Icahn School of Medicine at Mount Sinai,1.0
NCT01629615,A Phase II Trial of BKM120 (a PI3K Inhibitor) in Patients With Triple Negative Metastatic Breast Cancer,BKM120,DRUG,,COMPLETED,The purpose of this study is to evaluate the clinical activity of BKM120 in patients with metastatic triple-negative breast cancer.,SOLTI Breast Cancer Research Group,1.0
NCT04148937,A Phase 1 Multicenter Global First in Human Study of the CD73 Inhibitor LY3475070 as Monotherapy or in Combination With Pembrolizumab in Patients With Advanced Solid Malignancies,LY3475070; Pembrolizumab,DRUG; DRUG,,COMPLETED,The reason for this study is to see if the CD73 inhibitor LY3475070 alone or in combination with pembrolizumab is safe and effective in participants with advanced cancer.,Eli Lilly and Company,1.0
NCT03106415,Phase I/II Trial of Pembrolizumab in Combination With Binimetinib in Unresectable Locally Advanced or Metastatic Triple Negative Breast Cancer,Binimetinib; Laboratory Biomarker Analysis; Pembrolizumab,DRUG; OTHER; BIOLOGICAL,,COMPLETED,"This phase I/II trial studies the best dose of pembrolizumab and binimetinib and how well it works when given together with pembrolizumab in treating patients with triple negative breast cancer that has spread to other parts of the body (metastatic). Immunotherapy with monoclonal antibodies, such as pembrolizumab, may help the body's immune system attack the cancer, and may interfere with the ability of tumor cells to grow and spread. Binimetinib may stop the growth of tumor cells by blocking some of the enzymes needed for cell growth. Giving pembrolizumab and binimetinib may work better in treating patients with triple negative breast cancer.",Mayo Clinic,1.0
NCT02509507,"A Phase 1b/2, Multicenter, Open-label, Basket Trial to Evaluate the Safety of Talimogene Laherparepvec Injected Into Liver Tumors Alone and in Combination With Systemic Pembrolizumab in Phase 1b and to Evaluate the Efficacy and Safety of Intratumoral Talimogene Laherparepvec in Combination With Systemic Pembrolizumab to Treat Subjects With Advanced Solid Tumors in Phase 2 (MASTERKEY-318)",Talimogene Laherparepvec; Pembrolizumab,DRUG; DRUG,,COMPLETED,"This is a phase 1b/2, multicenter, open-label, basket trial to evaluate the safety of talimogene laherparepvec injected intrahepatically into liver tumors alone and in combination with systemic intravenous (IV) administration of pembrolizumab, in subjects with non-hepatocellular carcinoma (HCC) liver metastases from breast adenocarcinoma (BC), colorectal adenocarcinoma (CRC), gastroesophageal cancer (GEC), melanoma, non-small cell lung cancer (NSCLC), clear cell renal cell carcinoma (RCC) in Part 1 Group A, and subjects with HCC with and without viral hepatitis in Part 1 Group B (viral hepatitis is only applicable in combination setting), and to evaluate the efficacy and safety of intratumoral talimogene laherparepvec in combination with systemic pembrolizumab in subjects with advanced triple negative breast cancer (TNBC), hormone receptor positive breast cancer, CRC, cutaneous squamous cell carcinoma (CSCC), and basal cell carcinoma (BCC) in Part 2 Group A and subjects with HCC with and without viral hepatitis in Part 2 Group B. The objective of Part 1 is to evaluate the safety of intrahepatic injection of talimogene laherparepvec into liver tumors alone and in combination with systemically administered pembrolizumab for the non-HCC (Group A) and HCC (Group B) cohorts separately. Part 2 consists of 2-stage design to evaluate the efficacy and safety of talimogene laherparepvec in combination with systemic pembrolizumab. Efficacy and safety will be evaluated in each of the five non-HCC tumor types from Group A separately. Similarly, the efficacy and safety of the combination treatment will be determined for Group B HCC subjects. As of Protocol Amendment 6 (dated 26 October 2021), intrahepatic injections of talimogene laherparepvec and liver biopsies are no longer performed in this study. Enrollment for this study has stopped.",Amgen,1.0
NCT02158507,"An Open Label, Pilot Study of Veliparib (ABT-888) and Lapatinib (Tykerb) in Patients With Metastatic, Triple Negative (ER, PR, and HER-2 Negative) Breast Cancer",Combination of Veliparib + Lapatinib,DRUG,,COMPLETED,"This study will evaluate the effectiveness and safety of the combination of two drugs, Veliparib and Lapatinib, given to participants with metastatic triple negative breast cancer that have undergone previous treatment. Veliparib is an investigational drug and has not been approved by the FDA while Lapatinib has been approved by the FDA for another type of breast cancer. All eligible participants will receive the study medications and not a placebo.",University of Alabama at Birmingham,1.0
NCT01990209,A Phase II Study With Orteronel as Monotherapy in Patients With Metastatic Breast Cancer (MBC) That Expresses the Androgen Receptor (AR),Orteronel,DRUG,,COMPLETED,"The androgen receptor (AR) is expressed in 70-90 percent of primary breast tumors and in 75 percent of breast metastases. There is evidence to suggest that Androgen Receptor (AR) may be a target in patients with advanced breast cancer. Breast cancer patients whose tumors do not express the ER, PR or HER2 (triple negative) have very few options for treatment. Orteronel is being developed as an endocrine therapy for relevant hormone-sensitive cancers such as prostrate cancer and breast cancer. Triple-negative metastatic breast cancer patients with AR expression could potentially benefit from anti-androgen therapy like orteronel.","SCRI Development Innovations, LLC",1.0
NCT02876107,A Randomized Phase II Study of Neoadjuvant Carboplatin/Paclitaxel (CT) Versus Panitumumab/Carboplatin/Paclitaxel (PaCT) Followed by Anthracycline-Containing Regimen for Newly Diagnosed Primary Triple-Negative Inflammatory Breast Cancer,Carboplatin; Laboratory Biomarker Analysis; Paclitaxel; Panitumumab,DRUG; OTHER; DRUG; BIOLOGICAL,,ACTIVE_NOT_RECRUITING,"This randomized phase II trial studies how well carboplatin and paclitaxel with or without panitumumab work in treating patients with invasive triple negative breast cancer. Drugs used in the chemotherapy, such as carboplatin and paclitaxel, work in different ways to stop the growth of tumor cells, either by killing the cells, by stopping the them from dividing, or by stopping them from spreading. Monoclonal antibodies, such as panitumumab, may interfere with the ability of tumor cells to grow and spread. Giving carboplatin and paclitaxel with or without panitumumab before surgery may make the tumor smaller and reduce the amount of normal tissue that needs to be removed.",M.D. Anderson Cancer Center,1.0
NCT05504707,"Phase 1 Dose-Escalation, Dose-Expansion Trial of Intratumoral HER2- and HER3-Primed Dendritic Cells Injections for the Treatment of Early-Stage TNBC and ER Low Positive Breast Cancer (DecipHER)",HER2 - primed Dendritic cells; HER3 - primed Dendritic cells,BIOLOGICAL; BIOLOGICAL,,ACTIVE_NOT_RECRUITING,The purpose of the study is to find out if an investigational vaccine called Dendritic Cell (DC) vaccine given together with standard of care chemotherapy drugs can help people with Triple Negative and HR low positive breast cancer.,H. Lee Moffitt Cancer Center and Research Institute,1.0
NCT02101385,A Phase II Randomized Controlled Trial of Genomically Directed Therapy After Preoperative Chemotherapy in Patients With Triple Negative Breast Cancer: Hoosier Oncology Group BRE12-158,Genomically Directed Monotherapy; Observation/Standard Therapy,DRUG; OTHER,,COMPLETED,This study will test the theory that therapy designed for each individual's tumor will improve outcomes over standard of care in a population that needs a better standard.,"Bryan Schneider, MD",1.0
