trial_id,title,intervention_name,intervention_type,phase,status,summary,sponsor,outcome
NCT02263495,"A Phase II, Multicenter, Randomized Trial of Eribulin Plus Gemcitabine (EG) vs.Paclitaxel Plus Gemcitabine (PG) in Patients With HER2-Negative Metastatic Breast Cancer as First -Line Chemotherapy",Paclitaxel; Eribulin; Gemcitabine,DRUG; DRUG; DRUG,,COMPLETED,"Metastatic breast cancer (MBC) is an incurable disease and is needed to improve effective chemotherapy. Paclitaxel plus Gemcitabine (PG) combination chemotherapy is one of the preferred chemotherapeutic regimens for patients with MBC, and was found to be proper as a maintenance chemotherapy regimen with survival benefit and feasible toxicity profile as shown in a large phase III KCSG (Korean Cancer Study Group) study (Park Y et al. J Clin Oncol 31(14):1732, 2013).

Eribulin mesylate is a microtubule-targeting agent that showed improved overall survival benefit as monotherapy for MBC patients as a new chemotherapeutic agent after failure of anthracycline and taxane in EMBRACE study (Cortes J et. al. Lancet 377:914-923, 2011). Eribulin was also reported its promising efficacy in another randomized phase III study that demonstrated eribulin as efficacious as capecitabine (Kaufman P et. al. Abstr# S6-6, SABCS 2012). Both study results showed potential clinical benefit in patients with triple negative MBC (TNBC). Thus, eribulin combined with gemcitabine may be a new potential regimen for early line therapy in patients with metastatic breast cancer.

Furthermore, eribulin may have rational benefit compared with paclitaxel in terms of neurotoxicity. Although there is no direct evidence that eribulin has better neurotoxicity profile than taxane, eribulin tended to show less neurotoxicity compared with ixabepilone in a phase II trial (Vahdat, L et al. 2011 SABCS). Eribulin has no worsen toxicity as compared to paclitaxel. Therefore, EG may have less neurotoxicity comparing to PG.

In phase I trial, eribulin in combination with gemcitabine was feasible in patients with advanced solid tumor treated with chemotherapy (\< 3 lines) (Goel R, et al, 2009 ASCO).

Based on this rationale, the investigators are to conduct randomized phase II study comparing EG chemotherapy with PG chemotherapy for patients with HER-2 negative MBC as first-line chemotherapy.

A total of 118 patients will be recruited. Patients will be randomized to a treatment arm by permutated method. The randomization ratio is 1:1. This study is multi-center, randomized, open label study.",Asan Medical Center,1.0
NCT04584255,A Phase II Study of Niraparib With Dostarlimab Therapy as Neoadjuvant Treatment for Patients With BRCA-mutated Breast Cancer,Niraparib; Dostarlimab,DRUG; DRUG,,ACTIVE_NOT_RECRUITING,"This research study involves pre-operative therapy that is specifically targeted for breast cancer in individuals with BRCA and PALB2 mutations.

The names of the study drugs involved in this study are:

* Niraparib (Zejula)
* Dostarlimab",Dana-Farber Cancer Institute,1.0
NCT06618014,"A Single-Arm Phase II Trial of Neoadjuvant Toripalimab, Docetaxel, Plus Carboplatin in Patients With Localized Triple-Negative Breast Cancer",Toripalimab; Docetaxel; Carboplatin,DRUG; DRUG; DRUG,,COMPLETED,This study aims to investigate efficacy and safety of neoadjuvant toripalimab plus docetaxel and carboplatin in patients with localized triple-negative breast cancer.,Sun Yat-sen University,1.0
NCT07046195,Clinical Study of the Optimal Combination Mode of Adjuvant Radiotherapy Combined With Immunotherapy for Triple Negative Breast Cancer,,,,ACTIVE_NOT_RECRUITING,"Postoperative radiotherapy is a conventional treatment for breast cancer patients with a high risk of recurrence, such as those with regional lymph node metastasis, especially TNBC. However, the optimal mode of treatment for the combination of radiotherapy and immunotherapy has not yet been determined, especially in the adjuvant treatment phase. There is still a lack of validation and high-grade evidence on the safety and synergistic efficacy of radiotherapy-immunotherapy combinations. In this study, we aimed to compare the safety and preliminary efficacy of hypofractionated radiotherapy and concurrent immunotherapy with those of hypofractionated radiotherapy and sequential immunotherapy in the postoperative adjuvant stage through prospective real-world studies for TNBC patients, and focused on verifying the incidence of adverse reactions in radiotherapy and immunotherapy in the adjuvant stage, so as to find out the optimal combination mode of postoperative radiotherapy combined with immunotherapy, further reduce the distant metastasis of TNBC patients under the premise of ensuring safety, and improve long-term survival.",Sun Yat-Sen Memorial Hospital of Sun Yat-Sen University,1.0
NCT03761914,A Phase 1/2 Study of Galinpepimut-S in Combination With Pembrolizumab (MK 3475) in Patients With Selected Advanced Cancers,galinpepimut-S; pembrolizumab; Montanide; GM-CSF,BIOLOGICAL; BIOLOGICAL; OTHER; BIOLOGICAL,,COMPLETED,"To evaluate the safety, tolerability, and anti-tumor activity of galinpepimut-S in combination with pembrolizumab in patients with selected advanced cancers.",Sellas Life Sciences Group,1.0
NCT03893955,"A Phase 1, Multicenter, Open-Label Study to Determine the Safety, Tolerability, Pharmacokinetics, and Preliminary Efficacy of Combinations of ABBV-927 With ABBV-368, Budigalimab (ABBV-181) and/or Chemotherapy in Subjects With Locally Advanced or Metastatic Solid Tumors",ABBV-927; ABBV-368; ABBV-181; Carboplatin; Nab-paclitaxel,DRUG; DRUG; DRUG; DRUG; DRUG,,ACTIVE_NOT_RECRUITING,"A study evaluating the safety, pharmacokinetics (PK), pharmacodynamics, and preliminary efficacy of ABBV-927 with ABBV-368, Budigalimab (ABBV-181) and/or chemotherapy in participants with selected solid tumors. This study consists of 2 main parts, a dose-escalation phase and a dose-expansion phase. The dose-expansion phase can begin once the recommended phase 2 dose/maximum tolerated dose (RP2D/MTD) is determined in the dose-escalation phase.",AbbVie,1.0
NCT04690855,"A Multi-institutional Phase II Study to Evaluate Efficacy and Safety of TAlazoparib, Radiotherapy and Atezolizumab in gBRCA 1/2 Negative Patients With PD-L1+ Metastatic Triple Negative Breast Cancer",Talazoparib; Atezolizumab; Radiation,DRUG; DRUG; RADIATION,,TERMINATED,"This is a Phase II study designed to assess efficacy and safety of talazoparib, high dose radiation, and atezolizumab in patients with metastatic TNBC that is PD-L1 positive. A total of 23 gBRCA pathogenic variant negative patients will be enrolled. All patients will be treated with induction talazoparib of 1mg PO daily starting Day 1. Patients will then receive 8 Gy x 3 fractions to 2-4 metastatic lesions beginning Day 12,13, or 14 and given QOD. 840 mg of atezolizumab will be given intravenously (IV) on Day 15 of the 1st cycle and then on Day 1 and Day 15 of the remaining cycles. The sequence of administration is not specified on the days in which talazoparib and atezolizumab are given on the same day. Each cycle equals 28 days. Treatment will continue until progression or severe toxicity.

A safety lead in of up to 6 patients will be performed. Immune-related and non-immune related adverse events will be tracked up to 12 weeks post initiation of atezolizumab, as the majority of treatment-related toxicities from talazoparib, radiation, and atezolizumab occur within this time period.","Mylin A. Torres, MD",0.0
NCT02574455,"An International, Multi-Center, Open-Label, Randomized, Phase III Trial of Sacituzumab Govitecan Versus Treatment of Physician Choice in Patients With Metastatic Triple-Negative Breast Cancer Who Received at Least Two Prior Treatments",Sacituzumab govitecan; Eribulin; Capecitabine; Gemcitabine; Vinorelbine,DRUG; DRUG; DRUG; DRUG; DRUG,,COMPLETED,"The primary objective of this study is to compare the efficacy of sacituzumab govitecan to the treatment of physician's choice (TPC) as measured by independently-reviewed Independent Review Committee (IRC) progression-free survival (PFS) in participants with locally advanced or metastatic triple-negative breast cancer (TNBC) previously treated with at least two systemic chemotherapy regimens for unresectable, locally advanced or metastatic disease, and without brain metastasis at baseline.",Gilead Sciences,1.0
NCT02259114,"A Phase IB Trial With OTX015/MK-8628, a Small Molecule Inhibitor of the Bromodomain and Extra-Terminal (BET) Proteins, in Patients With Selected Advanced Solid Tumors",Birabresib,DRUG,,COMPLETED,"Open-label, phase I, non-randomized, multicentric study of single-agent birabresib (MK-8628) (formerly known as OTX015) administered according to two distinct regimens to participants with selected advanced tumors.

The study will be performed in two parts.

Dose Escalation Part:

This step is designed to determine the maximum tolerated dose (MTD) in each of the two regimens, which will be evaluated in parallel. Participants will receive oral birabresib according to:

Continuous Dosing Regimen: continuous, once daily for 21 consecutive days (21-day cycles).

OR Days 1-7 Dosing Regimen: once daily on Days 1 to 7, repeated every 3 weeks (21-day cycles; 1 week ON/2 weeks OFF).

Participants will be sequentially assigned to Continuous Dosing Regimen or Days 1-7 Dosing Regimen according to the next available place and receive birabresib at escalating doses levels (DL). Cohorts of 3 participants will be treated, and an additional 3 participants will be treated at the first indication of dose-limiting toxicity (DLT). MTD assessment will be based on the tolerability observed during the first 21 days of treatment.

Expansion Part:

The efficacy of birabresib in each of the five indications (i.e., Bromodomain-Nuclear Protein in Testis \[BRD-NUT\] midline carcinoma, triple negative breast cancer \[TNBC\], non-small cell lung cancer \[NSCLC\] harboring a rearrangement Anaplastic Lymphoma Kinase \[ALK\] gene/fusion protein or Kirsten Ras \[KRAS\] mutation, castrate-resistant prostate cancer, and pancreatic ductal carcinoma) will be assessed in terms of response (Response Evaluation Criteria in Solid Tumors v1.1 \[RECIST v1.1\] or Prostate Cancer Clinical Trials Working Group 2 \[PCWG2\]) using a selected regimen.","Oncoethix GmbH, a subsidiary of Merck & Co., Inc. (Rahway, New Jersey USA)",1.0
NCT02897050,Phase II Trial of Neoadjuvant Docetaxel ± Metronomic Capecitabine/CTX Followed by FEC in Women With Operable Triple Negative Breast Cancer,Docetaxel; Capecitabine; Cyclophosphamide (tablet); Fluorouracil; Epirubicin; Cyclophosphamide (injection),DRUG; DRUG; DRUG; DRUG; DRUG; DRUG,,SUSPENDED,"This multi-center, open-label, phase II randomized controlled trial is to evaluate the efficacy of docetaxel(T) combined with metronomic cyclophosphamide/capecitabine (mCX) followed by fluorouracil /epirubicin/cyclophosphamide (FEC) versus T followed by FEC as neoadjuvant chemotherapy in treating women with triple negative breast cancer (TNBC), and to study the anti-tumor immune effect of metronomic neoadjuvant chemotherapy. 186 stage M0 TNBC patients who had a primary tumor \> 2cm by imaging or an axillary lymph node \> 2cm by imaging are randomly enrolled to receive neoadjuvant T combined with mCX (3 cycles) followed by FEC (3 cycles) or T (3cycles) followed by FEC (3 cycles) before surgery. The primary end point is pathological complete response (pCR) rate, and the secondary end points include: clinical response rate, toxicities, breast-conserving rate, Ki67 and CD31 reduction rate, changes in the percentages of peripheral blood or tumor microenvironmental regulatory T cells (Treg), T helper cells (Th), CD8+ T cell, and tumor-specific CTL, and changes in tumor microenvironmental immune cytokines. Once there is a significant statistical difference in terms of pCR rate between two groups, 3-year disease-free survival (DFS) and 3-year overall survival (OS) will be included in the secondary end points. The aims of this study are to determine whether the neoadjuvant T combined with metronomic CX followed by FEC can significantly increase the pCR rate in TNBC with acceptable toxicity, and to explore the anti-tumor immune effect of metronomic neoadjuvant chemotherapy.",Sun Yat-Sen Memorial Hospital of Sun Yat-Sen University,0.0
NCT02743910,"Plasma Tumor DNA and Pathologic Complete Response in Early-Stage, High-Risk Breast Cancer",ptDNA; Tissue sample,OTHER; OTHER,,ACTIVE_NOT_RECRUITING,"This study is being done to see if it is possible to use blood samples to predict response to treatment in breast cancer patients receiving preoperative (or neoadjuvant) therapy. Research has shown that most breast cancers release tumor-specific DNA into the blood (that is, DNA that is specific to the tumor cells or cancer). This DNA can be detected in blood testing known as plasma tumor-DNA or ""ptDNA."" This DNA is separate from that found in the blood and tissue samples which serve as the ""instruction book"" or ""genetic code"" for the cells that make-up the human body. The changes in ptDNA before and after treatment, as well as after surgery, may also help investigators to understand more about a patient's risk of cancer returning and long-term outcomes.",Sidney Kimmel Comprehensive Cancer Center at Johns Hopkins,1.0
NCT01698281,"A Randomized Phase 2 Trial of AEZS-108 in Chemotherapy Refractory Triple Negative, LHRH-positive Metastatic Breast Cancer.",AEZS-108; SCCC; Dexamethasone,DRUG; DRUG; DRUG,,TERMINATED,This is a therapeutic exploratory Phase 2 study evaluating AEZS-108 compared to standard single agent cytotoxic chemotherapy (SSCC) as measured by the median time of progression-free survival (PFS) in patients with chemotherapy refractory triple negative (ER/PR/HER2-negative) LHRH-R positive metastatic breast cancer.,AEterna Zentaris,0.0
NCT01612910,"A Pilot Study of BR-DIM in Women With Stage II-III, Triple Negative, and Androgen Receptor Positive, Invasive Breast Cancer, Who Have Residual Disease Following Surgical Resection After Neoadjuvant Chemotherapy",oral microencapsulated diindolylmethane; laboratory biomarker analysis,DRUG; OTHER,,WITHDRAWN,"This study is being done to find out whether a nutritional supplement, called BioResponse-DIM (BR-DIM \[oral microencapsulated diindolylmethane\]), improves the survival for women who have residual cancer cells following surgery after chemotherapy for breast cancer. BR-DIM is an active ingredient in cruciferous vegetables (broccoli, brussels sprouts and cauliflower). Consumption of these vegetables has been associated with a decreased risk in several cancers. Researchers also hope to find out whether different biomarkers (also called ""markers"") in the blood predict the chance of breast cancer returning. BR-DIM is thought to be effective in treating stage II-III breast cancer that is triple negative, AR positive (+), and where there is residual cancer cells in the breast after chemotherapy.",Barbara Ann Karmanos Cancer Institute,0.0
NCT05730010,Discerning the Impact of ctDNA Detection on Patient Decision Making in Early Stage Breast Cancer: a Conjoint Analysis,,,,COMPLETED,This study will examine how ctDNA and additional prognostic genomic information in patients with early stage breast cancer might influences patient decision- making regarding systemic therapy options.,Indiana University,1.0
NCT00972023,A Pilot Study of Androgen Receptor as a Target for the Treatment of ER-/PR-/AR + Breast Cancer,DHEA; Surgical resection,DRUG; PROCEDURE,,TERMINATED,"RATIONALE: Dehydroepiandrosterone (DHEA) may slow the growth of tumor cells and be an effective treatment for women with breast cancer.

PURPOSE: This phase I trial is studying how well DHEA works in treating women undergoing surgery for stage I, stage II, or stage III breast cancer.",Barbara Ann Karmanos Cancer Institute,0.0
NCT02838823,"A Phase I,Open,Mono-center and Dose Escalation Study Investigating Tolerance and Pharmacokinetics of Single and Multiple Doses of Anti-PD-1 Monoclonal Antibody in Patients With Triple-negative Breast Cancer",humanized anti-PD-1 monoclonal antibody toripalimab,BIOLOGICAL,,COMPLETED,"This is a mono-center, open-label, phase 1 study evaluating the humanized anti-PD-1 antibody JS001, as a monotherapy in patients with triple negative breast cancer who have failed in routine systemic treatment. The study will be conducted in 2 parts: dose escalation and cohort expansion to investigate tolerability and efficacy.","Shanghai Junshi Bioscience Co., Ltd.",1.0
NCT01969643,"A Phase 1, Open-Label, Dose-Escalation Study to Evaluate the Safety and Tolerability of SGN-LIV1A in Patients With Metastatic Breast Cancer",ladiratuzumab vedotin; Trastuzumab,DRUG; DRUG,,COMPLETED,This study will examine the safety and tolerability of ladiratuzumab vedotin (LV) in patients with metastatic breast cancer. LV will be given alone or in combination with trastuzumab.,Seagen Inc.,1.0
NCT02779855,A Phase 1/2 Study of Talimogene Laherparepvec in Combination With Neoadjuvant Chemotherapy in Triple Negative Breast Cancer,Talimogene laherparepvec; Paclitaxel,BIOLOGICAL; DRUG,,ACTIVE_NOT_RECRUITING,"The purpose of this study is to determine if an oncolytic virus called Talimogene laherparepvec (a modified herpes simplex 1 virus that can specifically destroy cancer cells while leaving normal cells alone) injected directly into the tumor during chemotherapy prior to surgery can enhance the elimination of triple negative breast cancer tumors. The natural herpes simplex 1 virus typically causes cold sores around the mouth, but the talimogene laherparepvec version of the herpes virus has been changed to prevent it from reproducing in normal tissue.

However, it can still attack and break open cancer tissue which is why it is used as a treatment for cancer. It is thought that this virus can also help recruit the participant's immune system to attack the cancer cells during their treatment and possibly destroy the tumor tissue more effectively than chemotherapy alone. This virus is already FDA approved to treat melanoma skin tumors, so investigators want to determine if this virus can achieve a similar benefit in women with triple negative breast tumors.",H. Lee Moffitt Cancer Center and Research Institute,1.0
NCT04052555,"A Phase 1b Study of Berzosertib in Combination With Radiation Therapy to Overcome Therapeutic Resistance in Chemotherapy Resistant Triple Negative and Estrogen and/or Progesterone Receptor Positive, HER2 Negative Breast Cancer",Berzosertib; Biospecimen Collection; Quality-of-Life Assessment; Questionnaire Administration; Radiation Therapy,DRUG; PROCEDURE; OTHER; OTHER; RADIATION,,ACTIVE_NOT_RECRUITING,"This phase Ib trial studies the best dose of berzosertib when given together with the usual treatment (radiation therapy) in treating patients with triple negative or estrogen receptor and/or progesterone receptor positive, HER-2 negative breast cancer. Berzosertib may stop the growth of tumor cells by blocking some of the enzymes needed for cell growth. Radiation therapy uses high energy rays to kill tumor cells and shrink tumors. Giving M6620 and radiation therapy may kill tumor cells more effectively than radiation alone or shrink or stabilize breast cancer for longer than radiation therapy alone.",National Cancer Institute (NCI),1.0
NCT03150810,"A Phase 1b Study to Assess the Safety, Tolerability and Clinical Activity of BGB-290 in Combination With Temozolomide (TMZ) in Subjects With Locally Advanced or Metastatic Solid Tumors",Pamiparib; Temozolomide,DRUG; DRUG,,COMPLETED,"The primary objective of this study was to determine the safety and tolerability of pamiparib, the maximum tolerated dose (MTD) or maximum administered dose (MAD) for pamiparib combined with TMZ, to select the recommended Phase 2 dose (RP2D) and schedule of pamiparib in combination with TMZ, and to determine the antitumor activity of pamiparib in combination with TMZ.",BeiGene,1.0
NCT00031681,"A Phase I Study of UCN-01 in Combination With Irinotecan in Resistant Solid Tumor Malignancies (Part I) and in Triple Negative (ER-Negative, PgR-Negative, HER-2 Not-Amplified) Recurrent Breast Cancers (Part II)",7-hydroxystaurosporine; irinotecan hydrochloride; diagnostic laboratory biomarker analysis,DRUG; DRUG; OTHER,,COMPLETED,"This phase I trial is studying the side effects and best dose of giving 7-hydroxystaurosporine together with irinotecan hydrochloride in treating patients with metastatic or unresectable solid tumors, including triple-negative breast cancer (currently enrolling only patients with triple-negative breast cancer since 6/8/2007). Drugs used in chemotherapy use different ways to stop tumor cells from dividing so they stop growing or die. Giving 7-hydroxystaurosporine together with irinotecan hydrochloride may help kill more cancer cells by making tumor cells more sensitive to the drug.",National Cancer Institute (NCI),1.0
NCT02575781,A First-in-human Phase 1 Dose Escalation Study of SAR428926 in Patients With Advanced Solid Tumors,SAR428926,DRUG,,COMPLETED,"Primary Objectives:

To determine the maximum tolerated dose (MTD) of SAR428926 when administered as a single agent in patients with advanced solid tumors.

To evaluate the anti-tumor response of SAR428926 when administered as a single agent in patients with advanced triple negative breast cancer (TNBC) positive for the protein targeted by SAR428926 To assess the preliminary anti-tumor response of SAR428926 when administered as a single agent in patients with advanced solid tumors positive for the protein targeted by SAR428926

Secondary Objectives:

To determine the overall safety profile of SAR428926 as a single agent. To characterize the pharmacokinetics (PK) profile of SAR428926 and its metabolites.

To identify the recommended Phase 2 dose (RP2D) of SAR428926 as a single agent. To evaluate the immunogenicity of SAR428926. To assess the tumor response and duration of tumor response in all treated patients.

To evaluate the benefit of primary prophylaxis on the occurrence of corneal (keratopathy/keratitis) toxicity (Expansion cohorts).",Sanofi,1.0
NCT01837095,"A Phase I Dose Escalation Study of POL6326 With Eribulin in Patients With Relapsed, Triple Negative and Hormone Refractory ER Positive Metastatic Breast Cancer",POL6326,DRUG,,COMPLETED,"POL6326 will be given by i.v. infusion over 2 hours. Treatment will occur on days prior to, on the day of and on days after treatment with eribulin. Different doses and dosing frequencies will be investigated",Polyphor Ltd.,1.0
NCT02978495,Neoadjuvant Carboplatin in Triple Negative Breast Cancer - A Prospective Phase II Study (NACATRINE Trial).,Doxorubicin; Carboplatin; Paclitaxel; Cyclophosphamide,DRUG; DRUG; DRUG; DRUG,,COMPLETED,"Breast cancer is the most frequent neoplasm in women in Brazil and in the world and up to 15% of all cases diagnosed correspond to the triple negative subtype. Triple negative breast cancer affects young women with germline mutations in BRCA 1/2 genes. Giving the lack of target therapies to date, there is no consensus regarding the most effective treatment for this subgroup of tumors. Although evidence shows that triple negative breast cancer is highly sensitive to chemotherapy when compared to other breast tumors, there is no evidence to support the hypothesis that patients with triple negative breast cancer and mutation in BRCA1 / 2 genes have higher chemosensitivity to neoadjuvant therapy. The investigator proposes a prospective, randomized, open-label, phase II study, evaluating the rate of complete pathologic response, disease-free survival, overall survival and prognostic evaluation of BRCA1 / 2 mutation status in women with triple negative breast cancer submitted to sequential neoadjuvant chemotherapy based on anthracycline and taxane, with or without carboplatin.",Barretos Cancer Hospital,1.0
NCT02322814,"A Multistage, Phase II Study Evaluating the Safety and Efficacy of Cobimetinib Plus Paclitaxel, Cobimetinib Plus Atezolizumab Plus Paclitaxel, or Cobimetinib Plus Atezolizumab Plus Nab-Paclitaxel as First-Line Treatment for Patients With Metastatic Triple-Negative Breast Cancer",Cobimetinib; Paclitaxel; Placebo; Atezolizumab; Nab-Paclitaxel,DRUG; DRUG; DRUG; DRUG; DRUG,,TERMINATED,"This three-cohort, multi-stage, randomized, Phase II, multicenter trial will evaluate the safety and tolerability and estimate the efficacy of cobimetinib plus paclitaxel versus placebo plus paclitaxel in Cohort I, of cobimetinib plus atezolizumab plus paclitaxel in Cohort II, and of cobimetinib plus atezolizumab plus nab-paclitaxel in Cohort III in participants with metastatic or locally advanced, triple-negative adenocarcinoma of the breast who have not received prior systemic therapy for metastatic breast cancer (MBC). Participants may continue on study treatment until the development of progressive disease (PD) or the loss of clinical benefit, unacceptable toxicity, and/or consent withdrawal. The Cohort I target sample size is 12 participants for the safety run-in stage and approximately 90 participants in the expansion stage. Each of Cohorts II and III will consist of a safety run-in stage of approximately 15 participants followed by an expansion stage of approximately 15 participants.",Hoffmann-La Roche,0.0
